{
  "engineVersion": "0.1.0",
  "events": [
    {
      "minute": 1,
      "playerId": 8,
      "team": "home",
      "type": "corner",
      "x": 1.0,
      "y": 1.0
    },
    {
      "minute": 3,
      "otherPlayerId": 107,
      "playerId": 10,
      "team": "home",
      "type": "foul",
      "x": 0.261,
      "y": 0.167
    },
    {
      "minute": 3,
      "playerId": 10,
      "team": "home",
      "type": "yellow_card",
      "x": 0.261,
      "y": 0.167
    },
    {
      "minute": 3,
      "playerId": 7,
      "team": "home",
      "type": "corner",
      "x": 1.0,
      "y": 1.0
    },
    {
      "minute": 4,
      "outcome": "off",
      "playerId": 10,
      "team": "home",
      "type": "shot",
      "x": 0.753,
      "y": 0.245
    },
    {
      "minute": 6,
      "playerId": 107,
      "team": "away",
      "type": "corner",
      "x": 0.0,
      "y": 0.0
    },
    {
      "minute": 8,
      "otherPlayerId": 111,
      "playerId": 1,
      "team": "home",
      "type": "save",
      "x": 0.04,
      "y": 0.5
    },
    {
      "minute": 8,
      "outcome": "saved",
      "playerId": 111,
      "team": "away",
      "type": "shot",
      "x": 0.062,
      "y": 0.244
    },
    {
      "minute": 9,
      "otherPlayerId": 111,
      "playerId": 6,
      "team": "home",
      "type": "foul",
      "x": 0.15,
      "y": 0.374
    },
    {
      "minute": 10,
      "otherPlayerId": 108,
      "playerId": 7,
      "team": "home",
      "type": "foul",
      "x": 0.72,
      "y": 0.168
    },
    {
      "minute": 12,
      "playerId": 6,
      "team": "home",
      "type": "corner",
      "x": 1.0,
      "y": 0.0
    },
    {
      "minute": 14,
      "otherPlayerId": 111,
      "playerId": 1,
      "team": "home",
      "type": "save",
      "x": 0.04,
      "y": 0.5
    },
    {
      "minute": 14,
      "outcome": "saved",
      "playerId": 111,
      "team": "away",
      "type": "shot",
      "x": 0.054,
      "y": 0.354
    },
    {
      "minute": 14,
      "otherPlayerId": 3,
      "playerId": 107,
      "team": "away",
      "type": "foul",
      "x": 0.692,
      "y": 0.879
    },
    {
      "minute": 14,
      "otherPlayerId": 2,
      "playerId": 108,
      "team": "away",
      "type": "foul",
      "x": 0.592,
      "y": 0.679
    },
    {
      "minute": 15,
      "otherPlayerId": 106,
      "playerId": 1,
      "team": "home",
      "type": "save",
      "x": 0.04,
      "y": 0.5
    },
    {
      "minute": 15,
      "outcome": "saved",
      "playerId": 106,
      "team": "away",
      "type": "shot",
      "x": 0.086,
      "y": 0.529
    },
    {
      "minute": 15,
      "otherPlayerId": 107,
      "playerId": 7,
      "team": "home",
      "type": "foul",
      "x": 0.823,
      "y": 0.296
    },
    {
      "minute": 15,
      "otherPlayerId": 6,
      "playerId": 110,
      "team": "away",
      "type": "foul",
      "x": 0.179,
      "y": 0.265
    },
    {
      "minute": 16,
      "outcome": "blocked",
      "playerId": 11,
      "team": "home",
      "type": "shot",
      "x": 0.729,
      "y": 0.213
    },
    {
      "minute": 17,
      "otherPlayerId": 4,
      "playerId": 101,
      "team": "away",
      "type": "save",
      "x": 0.96,
      "y": 0.5
    },
    {
      "minute": 17,
      "outcome": "saved",
      "playerId": 4,
      "team": "home",
      "type": "shot",
      "x": 0.748,
      "y": 0.443
    },
    {
      "minute": 19,
      "otherPlayerId": 2,
      "playerId": 106,
      "team": "away",
      "type": "foul",
      "x": 0.281,
      "y": 0.141
    },
    {
      "minute": 21,
      "outcome": "blocked",
      "playerId": 109,
      "team": "away",
      "type": "shot",
      "x": 0.226,
      "y": 0.617
    },
    {
      "minute": 22,
      "playerId": 11,
      "team": "home",
      "type": "offside",
      "x": 0.846,
      "y": 0.805
    },
    {
      "minute": 25,
      "otherPlayerId": 4,
      "playerId": 107,
      "team": "away",
      "type": "foul",
      "x": 0.634,
      "y": 0.797
    },
    {
      "minute": 25,
      "playerId": 107,
      "team": "away",
      "type": "yellow_card",
      "x": 0.634,
      "y": 0.797
    },
    {
      "minute": 26,
      "playerId": 109,
      "team": "away",
      "type": "corner",
      "x": 0.0,
      "y": 0.0
    },
    {
      "minute": 27,
      "otherPlayerId": 102,
      "playerId": 7,
      "team": "home",
      "type": "foul",
      "x": 0.426,
      "y": 0.629
    },
    {
      "minute": 28,
      "otherPlayerId": 108,
      "playerId": 8,
      "team": "home",
      "type": "foul",
      "x": 0.526,
      "y": 0.297
    },
    {
      "minute": 28,
      "playerId": 7,
      "team": "home",
      "type": "corner",
      "x": 1.0,
      "y": 0.0
    },
    {
      "minute": 29,
      "otherPlayerId": 107,
      "playerId": 1,
      "team": "home",
      "type": "save",
      "x": 0.04,
      "y": 0.5
    },
    {
      "minute": 29,
      "outcome": "saved",
      "playerId": 107,
      "team": "away",
      "type": "shot",
      "x": 0.181,
      "y": 0.714
    },
    {
      "minute": 33,
      "otherPlayerId": 109,
      "playerId": 5,
      "team": "home",
      "type": "foul",
      "x": 0.21,
      "y": 0.695
    },
    {
      "minute": 34,
      "playerId": 110,
      "team": "away",
      "type": "offside",
      "x": 0.178,
      "y": 0.458
    },
    {
      "minute": 35,
      "playerId": 106,
      "team": "away",
      "type": "corner",
      "x": 0.0,
      "y": 1.0
    },
    {
      "minute": 38,
      "otherPlayerId": 109,
      "playerId": 2,
      "team": "home",
      "type": "foul",
      "x": 0.399,
      "y": 0.708
    },
    {
      "minute": 39,
      "playerId": 11,
      "team": "home",
      "type": "offside",
      "x": 0.709,
      "y": 0.898
    },
    {
      "minute": 40,
      "playerId": 6,
      "team": "home",
      "type": "corner",
      "x": 1.0,
      "y": 0.0
    },
    {
      "minute": 40,
      "playerId": 110,
      "team": "away",
      "type": "offside",
      "x": 0.291,
      "y": 0.189
    },
    {
      "minute": 41,
      "playerId": 11,
      "team": "home",
      "type": "offside",
      "x": 0.945,
      "y": 0.616
    },
    {
      "minute": 42,
      "outcome": "off",
      "playerId": 107,
      "team": "away",
      "type": "shot",
      "x": 0.193,
      "y": 0.622
    },
    {
      "minute": 42,
      "outcome": "off",
      "playerId": 111,
      "team": "away",
      "type": "shot",
      "x": 0.163,
      "y": 0.597
    },
    {
      "minute": 43,
      "outcome": "off",
      "playerId": 11,
      "team": "home",
      "type": "shot",
      "x": 0.941,
      "y": 0.542
    },
    {
      "minute": 44,
      "outcome": "off",
      "playerId": 108,
      "team": "away",
      "type": "shot",
      "x": 0.17,
      "y": 0.225
    },
    {
      "minute": 45,
      "otherPlayerId": 110,
      "playerId": 1,
      "team": "home",
      "type": "save",
      "x": 0.04,
      "y": 0.5
    },
    {
      "minute": 45,
      "outcome": "saved",
      "playerId": 110,
      "team": "away",
      "type": "shot",
      "x": 0.115,
      "y": 0.427
    },
    {
      "minute": 50,
      "outcome": "off",
      "playerId": 11,
      "team": "home",
      "type": "shot",
      "x": 0.75,
      "y": 0.213
    },
    {
      "minute": 51,
      "outcome": "off",
      "playerId": 105,
      "team": "away",
      "type": "shot",
      "x": 0.133,
      "y": 0.786
    },
    {
      "minute": 51,
      "playerId": 9,
      "team": "home",
      "type": "corner",
      "x": 1.0,
      "y": 0.0
    },
    {
      "minute": 51,
      "otherPlayerId": 11,
      "playerId": 104,
      "team": "away",
      "type": "foul",
      "x": 0.696,
      "y": 0.778
    },
    {
      "minute": 51,
      "playerId": 104,
      "team": "away",
      "type": "yellow_card",
      "x": 0.696,
      "y": 0.778
    },
    {
      "minute": 52,
      "playerId": 2,
      "team": "home",
      "type": "corner",
      "x": 1.0,
      "y": 0.0
    },
    {
      "minute": 53,
      "outcome": "blocked",
      "playerId": 6,
      "team": "home",
      "type": "shot",
      "x": 0.723,
      "y": 0.515
    },
    {
      "minute": 53,
      "otherPlayerId": 105,
      "playerId": 4,
      "team": "home",
      "type": "foul",
      "x": 0.769,
      "y": 0.777
    },
    {
      "minute": 57,
      "playerId": 108,
      "team": "away",
      "type": "corner",
      "x": 0.0,
      "y": 1.0
    },
    {
      "minute": 58,
      "otherPlayerId": 6,
      "playerId": 104,
      "team": "away",
      "type": "foul",
      "x": 0.245,
      "y": 0.794
    },
    {
      "minute": 59,
      "otherPlayerId": 8,
      "playerId": 101,
      "team": "away",
      "type": "save",
      "x": 0.96,
      "y": 0.5
    },
    {
      "minute": 59,
      "outcome": "saved",
      "playerId": 8,
      "team": "home",
      "type": "shot",
      "x": 0.923,
      "y": 0.768
    },
    {
      "minute": 59,
      "otherPlayerId": 109,
      "playerId": 1,
      "team": "home",
      "type": "save",
      "x": 0.04,
      "y": 0.5
    },
    {
      "minute": 59,
      "outcome": "saved",
      "playerId": 109,
      "team": "away",
      "type": "shot",
      "x": 0.051,
      "y": 0.623
    },
    {
      "minute": 61,
      "outcome": "goal",
      "playerId": 111,
      "team": "away",
      "type": "goal",
      "x": 0.16,
      "y": 0.745
    },
    {
      "minute": 61,
      "playerId": 109,
      "team": "away",
      "type": "corner",
      "x": 0.0,
      "y": 0.0
    },
    {
      "minute": 66,
      "otherPlayerId": 2,
      "playerId": 104,
      "team": "away",
      "type": "foul",
      "x": 0.199,
      "y": 0.138
    },
    {
      "minute": 69,
      "otherPlayerId": 103,
      "playerId": 4,
      "team": "home",
      "type": "foul",
      "x": 0.321,
      "y": 0.892
    },
    {
      "minute": 70,
      "otherPlayerId": 8,